{
  "schema_version": "dataset-manifest-v1",
  "layer": "features",
  "dataset_kind": "footprint_microstructure",
  "venue": "bybit",
  "instrument": "BTCUSDT",
  "feature_set_slug": "footprint_microstructure",
  "feature_set_version": 2,
  "record_schema_id": "feature-set-v1",
  "created_at": "2026-08-02T00:00:00Z",
  "derived_from": [
    {
      "layer": "features",
      "dataset_kind": "trade_microstructure",
      "venue": "bybit",
      "instrument": "BTCUSDT",
      "feature_set_slug": "trade_microstructure",
      "feature_set_version": 1,
      "record_schema_id": "feature-set-v1"
    }
  ],
  "transform": "build-footprint-microstructure-v2",
  "rel_root": "features/footprint_microstructure/bybit/BTCUSDT/footprint_microstructure/v2/feature-set-v1"
}
