{
  "schema_version": "dataset-manifest-v1",
  "layer": "canonical",
  "dataset_kind": "trades",
  "venue": "bybit",
  "instrument": "BTCUSDT",
  "record_schema_id": "trade-v1",
  "created_at": "2026-08-01T00:05:00Z",
  "derived_from": [
    {
      "layer": "raw",
      "dataset_kind": "trades",
      "venue": "bybit",
      "instrument": "BTCUSDT",
      "record_schema_id": "trade-v1"
    }
  ],
  "transform": "canonicalize-trades-v1",
  "rel_root": "canonical/trades/bybit/BTCUSDT/trade-v1"
}
