{
  "schema_version": "dataset-manifest-v1",
  "layer": "features",
  "dataset_kind": "trade_microstructure",
  "venue": "bybit",
  "instrument": "BTCUSDT",
  "feature_set_slug": "trade_microstructure",
  "feature_set_version": 1,
  "record_schema_id": "feature-set-v1",
  "created_at": "2026-08-01T00:20:00Z",
  "derived_from": [
    {
      "layer": "canonical",
      "dataset_kind": "trades",
      "venue": "bybit",
      "instrument": "BTCUSDT",
      "record_schema_id": "trade-v1"
    }
  ],
  "transform": "build-trade-microstructure-v1",
  "rel_root": "features/trade_microstructure/bybit/BTCUSDT/trade_microstructure/v1/feature-set-v1"
}
