{
  "schema_version": "dataset-manifest-v1",
  "layer": "canonical",
  "dataset_kind": "footprint",
  "venue": "bybit",
  "instrument": "BTCUSDT",
  "record_schema_id": "footprint-v1",
  "created_at": "2026-08-01T00:10:00Z",
  "derived_from": [
    {
      "layer": "canonical",
      "dataset_kind": "trades",
      "venue": "bybit",
      "instrument": "BTCUSDT",
      "record_schema_id": "trade-v1"
    },
    {
      "layer": "canonical",
      "dataset_kind": "l2",
      "venue": "bybit",
      "instrument": "BTCUSDT",
      "record_schema_id": "l2-v1"
    }
  ],
  "transform": "build-footprint-v1",
  "rel_root": "canonical/footprint/bybit/BTCUSDT/footprint-v1"
}
